{
  "schema_version": "1.0.0",
  "messages": [
    {
      "id": "msg-1",
      "role": "system",
      "content": "You are a data analysis assistant.",
      "timestamp": "2025-09-05T10:00:00Z"
    },
    {
      "id": "msg-2",
      "role": "user",
      "content": "Give me the numbers.",
      "timestamp": "2025-09-05T10:00:05Z"
    }
  ],
  "documents": [],
  "tool_events": []
}
